{
  "oap_version": "0.2.0",
  "kind": "oap.casting_call",
  "call_id": "call_2026_conflict_002",
  "director": {
    "name": "Commercial Director Y",
    "did": "oap:ed25519:test_director_key_2"
  },
  "project": {
    "title": "Vote For Candidate Z",
    "synopsis": "A political campaign advertisement with high action and graphic gore.",
    "intent": "political_ad",
    "content": {
      "nudity": "none",
      "sexual_content": "none",
      "blood_gore": "graphic",
      "violence": "graphic"
    },
    "commercial_category": "gambling",
    "brand": "GenericTobaccoCorp"
  },
  "role": {
    "character_name": "Campaign Spokesperson",
    "description": "Intense spokesperson in dramatic attire.",
    "wardrobe_requirement": "Neon jumpsuit",
    "requires_wardrobe_change": true,
    "voice_required": true,
    "audition_side": "Everything you knew is changing now."
  },
  "compensation": {
    "offer": "500",
    "currency": "USD",
    "notes": ""
  },
  "deadline": "2026-10-15T00:00:00Z",
  "submission_endpoint": "https://ad-agency.example/submissions"
}
